{
  "currency": "USD",
  "daily_budget": null,
  "frontier_calls": 0,
  "maximum_frontier_calls": 8,
  "maximum_model_escalations": 2,
  "maximum_paid_probes": 0,
  "maximum_parallel_agents": 4,
  "maximum_provider_switches": 1,
  "maximum_reasoning_escalations": 2,
  "maximum_repair_loops": 3,
  "mode": "BALANCED",
  "model_escalations": 0,
  "monthly_budget": null,
  "paid_probes": 0,
  "per_task_budget": null,
  "per_workflow_budget": null,
  "provider_specific_limits": {},
  "provider_switches": 0,
  "reasoning_escalations": 0,
  "spent_month": 0.0,
  "spent_today": 0.0,
  "updated_at": "2026-07-24T00:00:00+08:00"
}
